{
  "tuple_type": "AGENT_DISSENT",
  "id": "dissent",
  "time": "2026-07-11T10:00:00Z",
  "actor": "agent-e2",
  "principal": "user-005",
  "control_mode": "AI_PROPOSE_USER_CONFIRM",
  "tuple_data": {
    "authored_by": "agent-e2",
    "represented_principal": "user-005",
    "owner": "user-005",
    "receipted_by": "receipt-007",
    "actor_regime": "user_plus_agent_team",
    "evidence_links": [],
    "receipt_link": "receipt-dissent",
    "visibility_class": "private",
    "epistemic_permission": "challenge",
    "durable_write_permission": "none",
    "action_permission": "none",
    "approval_requirement": "required",
    "authority_source": "user-001",
    "scope": "bounded",
    "expiry": "2026-12-31",
    "revocation_state": "active",
    "dissented_claim": "Redesign improved satisfaction",
    "dissent_reason": "Survey sample was biased toward existing users",
    "dissent_evidence": [
      "methodology-review-001"
    ],
    "resolution_posture": "unresolved",
    "independence_class": "single_lineage"
  }
}
